{
  "$schema": "https://json-schema.org/draft/2020-12/schema",
  "title": "currencies file",
  "type": "array",
  "items": {
    "type": "object",
    "properties": {
      "id": {
        "type": "string"
      },
      "name": {
        "type": "string"
      },
      "description": {
        "type": "string"
      },
      "icon": {
        "type": "string"
      }
    },
    "required": [
      "id",
      "name",
      "description",
      "icon"
    ],
    "additionalProperties": false
  }
}
